ID,Company,Role,Status,Source,Date Applied,Next Action,Notes
1,Bosch India,Senior Embedded Engineer,draft,Naukri,2026-04-20,Finalize Zephyr mission computer write-up for batch #1 submissions (10 companies).,Target ₹15-18 LPA; aligns with 50-application OKR.
2,Texas Instruments,Firmware Engineer,draft,LinkedIn,2026-04-27,Record TinyML demo clip tailored to TI automotive group.,Part of referral cohort via alumni; counts toward 50 target.
3,Tata Elxsi,Lead IoT Developer,draft,Company Careers,2026-05-04,Ship OTA/fleet ops case study PDF and prepare HR intro.,Batch #2 of 5 targeted design consultancies.
4,Continental Automotive,Embedded Safety Engineer,draft,Naukri,2026-05-11,Highlight ASIL-B safety manager metrics in cover letter.,Focus on ISO 26262 readiness; part of 50-app log.
5,Qualcomm Hyderabad,Senior Firmware Engineer,draft,LinkedIn,2026-05-18,Benchmark throughput numbers on Ryzen rig for RF-heavy resume bullet.,Batch #3 (SoC vendors) – 8 submissions planned.
6,Ola Electric,IoT Platform Lead,draft,Referral,2026-05-25,Schedule mock interview to stress-test fleet ops story.,Supports ₹20L+ target roles; includes 5 allied startups.
7,NVIDIA Embedded,Edge AI Engineer,draft,LinkedIn,2026-06-01,Publish RTX 5060 Ti CUDA TinyML benchmark blog before applying.,Batch #4 (AI heavy) – ensures PC max-out narrative.
8,Bosch Global Software,IoT Developer,draft,Hackster.io,2026-06-08,Share community talk + open-source contribution links for follow-up.,Represents second wave of Bosch applications; keeps 50-app cadence warm.
